{"$schema":"./architecture/schemas/architecture-lock-v1.schema.json","catalog_revision":"2026.08.0","delivery_contract":"docker-release/v1","exception_ids":[],"lock_sha256":"a1edfa44ec13aa24a6574e1420b659c727590abb40994447c969f663d3c38b5e","profile_id":"linux-node-postgres-v1","profile_version":"1.0.0","project_id":"newemaint-target-candidate","resolved_components":[{"component_id":"container.compose.5","source_url":"https://github.com/docker/compose/releases/tag/v5.1.4","state":"preferred","version":"5.1.4"},{"component_id":"container.docker-engine.29","source_url":"https://docs.docker.com/engine/install/","state":"preferred","version":"29.7.1"},{"component_id":"database.postgresql.18","source_url":"https://www.postgresql.org/support/versioning/","state":"preferred","version":"18.4"},{"component_id":"framework.next.16","source_url":"https://nextjs.org/blog","state":"preferred","version":"16.2.11"},{"component_id":"frontend.react.19","source_url":"https://react.dev/versions","state":"preferred","version":"19.3.0"},{"component_id":"oci.node.24-bookworm-slim","digest":"sha256:6f7b03f7c2c8e2e784dcf9295400527b9b1270fd37b7e9a7285cf83b6951452d","source_url":"https://hub.docker.com/_/node","state":"preferred","version":"24.18.0-bookworm-slim"},{"component_id":"orm.prisma.7","source_url":"https://github.com/prisma/prisma/releases/tag/7.8.0","state":"preferred","version":"7.8.0"},{"component_id":"os.ubuntu.24-04-4","source_url":"https://documentation.ubuntu.com/release-notes/24.04/","state":"preferred","version":"24.04.4"},{"component_id":"package.npm.11","source_url":"https://docs.npmjs.com/cli/v11","state":"preferred","version":"11.19.0"},{"component_id":"proxy.nginx.1-30","source_url":"https://nginx.org/en/download.html","state":"preferred","version":"1.30.4"},{"component_id":"runtime.node.24","source_url":"https://nodejs.org/en/about/previous-releases","state":"preferred","version":"24.18.0"},{"component_id":"toolchain.typescript.6","source_url":"https://www.typescriptlang.org/docs/handbook/release-notes/typescript-6-0.html","state":"preferred","version":"6.0.2"}],"schema_version":"1.0","source_checksums":{"catalog_sha256":"1653a67f1b4b8d538bab86df5ed91b60cb961ed99be7c4148a91f47b339fef2b","declaration_sha256":"b25fd535d98cc0bf3a722d0efd44af21b24384f6defe28f526cb6983bf0d1835","profile_sha256":"7ca948928bf65b54e53a2d776c48a1ae4ac9a89b8f8ad3df3098c224bc8884c8"}}
