{"$schema":"./architecture/schemas/architecture-lock-v1.schema.json","catalog_revision":"2026.08.0","delivery_contract":"embedded-sqlite/v1","exception_ids":[],"lock_sha256":"c8c60aea3957768e5edd58b035b94e110cf46e093b8f081bd60e874af3c04a90","profile_id":"small-embedded-sqlite-v1","profile_version":"1.0.0","project_id":"sqlite-reference-candidate","resolved_components":[{"component_id":"database.sqlite.3","source_url":"https://sqlite.org/changes.html","state":"preferred","version":"3.53.3"},{"component_id":"os.ubuntu.24-04-4","source_url":"https://documentation.ubuntu.com/release-notes/24.04/","state":"preferred","version":"24.04.4"},{"component_id":"package.npm.11","source_url":"https://docs.npmjs.com/cli/v11","state":"preferred","version":"11.19.0"},{"component_id":"runtime.node.24","source_url":"https://nodejs.org/en/about/previous-releases","state":"preferred","version":"24.18.0"}],"schema_version":"1.0","source_checksums":{"catalog_sha256":"1653a67f1b4b8d538bab86df5ed91b60cb961ed99be7c4148a91f47b339fef2b","declaration_sha256":"5d8cc4f954ea3e93fd30ae935cbfd32d2b2d13a1889106584cca6174930c5554","profile_sha256":"329458bf93f00512524fe0aeaf3192b1db2b994b3b6b5a6b56649c1765a22016"}}
